### ISSUE TITLE
how to route all traffics out using an exit node?

### ISSUE THREAD

**Issue by yubiao** [jamesog/tailscale-edgeos#18]
I tried to start tailscale by routing all traffics to an exit node
`tailscale up --exit-node=xxx.xxx.xxx.xxx`
but then the edge router is stuck and no internet access. Am I doing this the wrong way?

**Comment by jamesog** [comment]
Given the device itself is a router it's probably not a good idea to have it use an exit node, but it would be fine to use it as an exit node. It depends how it talks to your ISP, DNS resolvers, etc.

Have you tried to do a packet capture to see what gets stuck?

**Comment by yubiao** [comment]
after the command `tailscale up --exit-node=xxx.xxx.xxx.xxx`, I cannot ssh into the router or open its web GUI.

**Comment by yubiao** [comment]
My simple use case is that I want every device connected to this edge router to have its traffic routed through the exit node.

**Comment by yubiao** [comment]
Once I issued the tailscale up command with exit node, I got the following tcpdump on my macOS
```
12:14:58.629247 IP 192.168.1.38.64160 > 101.32.133.53.http: Flags [S], seq 2332259726, win 65535, options [mss 1460,nop,wscale 6,nop,nop,TS val 189479240 ecr 0,sackOK,eol], length 0
12:14:58.657177 IP 192.168.1.38.55502 > 192.168.1.1.domain: 60600+ PTR? 53.133.32.101.in-addr.arpa. (44)
12:14:59.129295 IP 192.168.1.38.64159 > 49.51.89.176.http: Flags [S], seq 1679027261, win 65535, options [mss 1460,nop,wscale 6,nop,nop,TS val 1347716443 ecr 0,sackOK,eol], length 0
12:14:59.262044 IP 192.168.1.38 > 192.168.1.1: ICMP echo request, id 26270, seq 0, length 56
12:14:59.402413 IP 192.168.1.38.64095 > 192.168.1.1.ssh: Flags [P.], seq 2112:2148, ack 2865, win 2048, options [nop,nop,TS val 4164401447 ecr 3107624715], length 36
12:14:59.629531 IP 192.168.1.38.64160 > 101.32.133.53.http: Flags [S], seq 2332259726, win 65535, options [mss 1460,nop,wscale 6,nop,nop,TS val 189480241 ecr 0,sackOK,eol], length 0
12:14:59.641173 IP 192.168.1.38.51197 > 192.168.1.255.59870: UDP, length 187
12:14:59.641485 IP 192.168.1.38.50773 > 192.168.1.255.59870: UDP, length 221
12:14:59.641584 IP 192.168.1.38.61338 > 192.168.2.226.59871: UDP, length 136
12:14:59.641790 IP 192.168.1.38.57370 > 192.168.1.255.59870: UDP, length 215
12:14:59.641849 IP 192.168.1.38.55170 > 192.168.2.226.59871: UDP, length 185
12:14:59.642060 IP 192.168.1.38.61828 > 192.168.1.255.59870: UDP, length 175
12:14:59.642065 IP 192.168.1.38.52296 > 192.168.2.226.59871: UDP, length 215
12:14:59.642302 IP 192.168.1.38.62797 > 192.168.2.226.59871: UDP, length 214
12:14:59.707133 IP 192.168.1.38.55502 > 192.168.1.1.domain: 60600+ PTR? 53.133.32.101.in-addr.arpa. (44)
12:14:59.999663 IP 192.168.1.38.64156 > 192.168.1.1.https: Flags [P.], seq 1583:2597, ack 421, win 2052, options [nop,nop,TS val 2338467311 ecr 3107619561], length 1014
12:15:00.130783 IP 192.168.1.38.64159 > 49.51.89.176.http: Flags [S], seq 1679027261, win 65535, options [mss 1460,nop,wscale 6,nop,nop,TS val 1347717444 ecr 0,sackOK,eol], length 0
12:15:00.257898 IP 192.168.1.38.64070 > cdn-185-199-111-133.github.com.https: Flags [.], ack 1, win 2048, length 0
12:15:00.261088 IP 192.168.1.38 > 192.168.1.1: ICMP echo request, id 41725, seq 0, length 56
12:15:00.263384 ARP, Request who-has 192.168.1.2 tell 192.168.1.1, length 46
12:15:00.352557 IP 192.168.1.38.64047 > ec2-54-190-115-222.us-west-2.compute.amazonaws.com.https: Flags [P.], seq 2924:3223, ack 7318, win 2048, options [nop,nop,TS val 357951540 ecr 3270648756], length 299
12:15:00.352711 IP 192.168.1.38.64047 > ec2-54-190-115-222.us-west-2.compute.amazonaws.com.https: Flags [P.], seq 3223:3269, ack 7318, win 2048, options [nop,nop,TS val 357951540 ecr 3270648756], length 46
12:15:00.435508 IP 192.168.1.38.64047 > ec2-54-190-115-222.us-west-2.compute.amazonaws.com.https: Flags [P.], seq 3269:3401, ack 7318, win 2048, options [nop,nop,TS val 357951623 ecr 3270648756], length 132
12:15:00.576673 IP 192.168.1.38.64047 > ec2-54-190-115-222.us-west-2.compute.amazonaws.com.https: Flags [P.], seq 2924:3401, ack 7318, win 2048, options [nop,nop,TS val 357951764 ecr 3270648756], length 477
12:15:00.630782 IP 192.168.1.38.64160 > 101.32.133.53.http: Flags [S], seq 2332259726, win 65535, options [mss 1460,nop,wscale 6,nop,nop,TS val 189481242 ecr 0,sackOK,eol], length 0
12:15:00.829899 IP 192.168.1.38.64047 > ec2-54-190-115-222.us-west-2.compute.amazonaws.com.https: Flags [P.], seq 2924:3401, ack 7318, win 2048, options [nop,nop,TS val 357952017 ecr 3270648756], length 477
12:15:01.130797 IP 192.168.1.38.64161 > 101.32.133.209.http: Flags [S], seq 3903289126, win 65535, options [mss 1460,nop,wscale 6,nop,nop,TS val 2302265741 ecr 0,sackOK,eol], length 0
12:15:01.131982 IP 192.168.1.38.64159 > 49.51.89.176.http: Flags [S], seq 1679027261, win 65535, options [mss 1460,nop,wscale 6,nop,nop,TS val 1347718445 ecr 0,sackOK,eol], length 0
12:15:01.134289 IP 192.168.1.38.64047 > ec2-54-190-115-222.us-west-2.compute.amazonaws.com.https: Flags [P.], seq 2924:3401, ack 7318, win 2048, options [nop,nop,TS val 357952322 ecr 3270648756], length 477
12:15:01.236967 IP 192.168.1.38.64156 > 192.168.1.1.https: Flags [F.], seq 2597, ack 421, win 2052, options [nop,nop,TS val 2338468548 ecr 3107619561], length 0
12:15:01.261820 IP 192.168.1.38 > 192.168.1.1: ICMP echo request, id 22122, seq 0, length 56
12:15:01.290292 ARP, Request who-has 192.168.1.2 tell 192.168.1.1, length 46
12:15:01.543382 IP 192.168.1.38.64047 > ec2-54-190-115-222.us-west-2.compute.amazonaws.com.https: Flags [P.], seq 2924:3401, ack 7318, win 2048, options [nop,nop,TS val 357952731 ecr 3270648756], length 477
12:15:01.631482 IP 192.168.1.38.64160 > 101.32.133.53.http: Flags [S], seq 2332259726, win 65535, options [mss 1460,nop,wscale 6,nop,nop,TS val 189482243 ecr 0,sackOK,eol], length 0
12:15:01.807199 IP 192.168.1.38.55502 > 192.168.1.1.domain: 60600+ PTR? 53.133.32.101.in-addr.arpa. (44)
12:15:02.131577 IP 192.168.1.38.64161 > 101.32.133.209.http: Flags [S], seq 3903289126, win 65535, options [mss 1460,nop,wscale 6,nop,nop,TS val 2302266742 ecr 0,sackOK,eol], length 0
12:15:02.160685 IP 192.168.1.38.64047 > ec2-54-190-115-222.us-west-2.compute.amazonaws.com.https: Flags [P.], seq 2924:3401, ack 7318, win 2048, options [nop,nop,TS val 357953348 ecr 3270648756], length 477
12:15:02.261898 IP 192.168.1.38 > 192.168.1.1: ICMP echo request, id 36329, seq 0, length 56
12:15:02.314320 ARP, Request who-has 192.168.1.2 tell 192.168.1.1, length 46
12:15:02.632790 IP 192.168.1.38.64160 > 101.32.133.53.http: Flags [S], seq 2332259726, win 65535, options [mss 1460,nop,wscale 6,nop,nop,TS val 189483244 ecr 0,sackOK,eol], length 0
12:15:02.643394 IP 192.168.1.38.53418 > 192.168.1.255.59870: UDP, length 157
12:15:02.643665 IP 192.168.1.38.54054 > 192.168.2.226.59871: UDP, length 193
12:15:02.643723 IP 192.168.1.38.50267 > 192.168.1.255.59870: UDP, length 197
12:15:02.644015 IP 192.168.1.38.53649 > 192.168.2.226.59871: UDP, length 189
12:15:02.803904 IP 192.168.1.38.64095 > 192.168.1.1.ssh: Flags [P.], seq 2112:2148, ack 2865, win 2048, options [nop,nop,TS val 4164404848 ecr 3107624715], length 36
12:15:03.132972 IP 192.168.1.38.64161 > 101.32.133.209.http: Flags [S], seq 3903289126, win 65535, options [mss 1460,nop,wscale 6,nop,nop,TS val 2302267743 ecr 0,sackOK,eol], length 0
12:15:03.133019 IP 192.168.1.38.64159 > 49.51.89.176.http: Flags [S], seq 1679027261, win 65535, options [mss 1460,nop,wscale 6,nop,nop,TS val 1347720446 ecr 0,sackOK,eol], length 0
12:15:03.193293 IP 192.168.1.38.64047 > ec2-54-190-115-222.us-west-2.compute.amazonaws.com.https: Flags [P.], seq 2924:3401, ack 7318, win 2048, options [nop,nop,TS val 357954381 ecr 3270648756], length 477
12:15:03.261641 IP 192.168.1.38 > 192.168.1.1: ICMP echo request, id 37499, seq 0, length 56
12:15:03.310566 IP 192.168.1.38.64162 > 192.168.1.1.https: Flags [S], seq 730724006, win 65535, options [mss 1460,nop,wscale 6,nop,nop,TS val 3270270739 ecr 0,sackOK,eol], length 0
12:15:03.399652 IP 192.168.1.38.64156 > 192.168.1.1.https: Flags [FP.], seq 1583:2597, ack 421, win 2052, options [nop,nop,TS val 2338470711 ecr 3107619561], length 1014
12:15:03.561386 IP 192.168.1.38.64163 > 192.168.1.1.https: Flags [S], seq 2791785047, win 65535, options [mss 1460,nop,wscale 6,nop,nop,TS val 3067779961 ecr 0,sackOK,eol], length 0
12:15:03.632985 IP 192.168.1.38.64160 > 101.32.133.53.http: Flags [S], seq 2332259726, win 65535, options [mss 1460,nop,wscale 6,nop,nop,TS val 189484244 ecr 0,sackOK,eol], length 0
12:15:04.134084 IP 192.168.1.38.64161 > 101.32.133.209.http: Flags [S], seq 3903289126, win 65535, options [mss 1460,nop,wscale 6,nop,nop,TS val 2302268745 ecr 0,sackOK,eol], length 0
12:15:04.261899 IP 192.168.1.38 > 192.168.1.1: ICMP echo request, id 29692, seq 0, length 56
12:15:04.310699 IP 192.168.1.38.64162 > 192.168.1.1.https: Flags [S], seq 730724006, win 65535, options [mss 1460,nop,wscale 6,nop,nop,TS val 3270271739 ecr 0,sackOK,eol], length 0
12:15:04.562794 IP 192.168.1.38.64163 > 192.168.1.1.https: Flags [S], seq 2791785047, win 65535, options [mss 1460,nop,wscale 6,nop,nop,TS val 3067780962 ecr 0,sackOK,eol], length 0
12:15:04.578886 IP 192.168.1.38.64047 > ec2-54-190-115-222.us-west-2.compute.amazonaws.com.https: Flags [P.], seq 2924:3401, ack 7318, win 2048, options [nop,nop,TS val 357955766 ecr 3270648756], length 477
12:15:05.135972 IP 192.168.1.38.64161 > 101.32.133.209.http: Flags [S], seq 3903289126, win 65535, options [mss 1460,nop,wscale 6,nop,nop,TS val 2302269746 ecr 0,sackOK,eol], length 0
12:15:05.261036 IP 192.168.1.38 > 192.168.1.1: ICMP echo request, id 37438, seq 0, length 56
12:15:05.262860 ARP, Request who-has 192.168.1.2 tell 192.168.1.1, length 46
12:15:05.312072 IP 192.168.1.38.64162 > 192.168.1.1.https: Flags [S], seq 730724006, win 65535, options [mss 1460,nop,wscale 6,nop,nop,TS val 3270272741 ecr 0,sackOK,eol], length 0
12:15:05.563169 IP 192.168.1.38.64163 > 192.168.1.1.https: Flags [S], seq 2791785047, win 65535, options [mss 1460,nop,wscale 6,nop,nop,TS val 3067781963 ecr 0,sackOK,eol], length 0
12:15:05.632971 IP 192.168.1.38.64160 > 101.32.133.53.http: Flags [S], seq 2332259726, win 65535, options [mss 1460,nop,wscale 6,nop,nop,TS val 189486245 ecr 0,sackOK,eol], length 0
12:15:05.645071 IP 192.168.1.38.64853 > 192.168.1.255.59870: UDP, length 162
12:15:05.645377 IP 192.168.1.38.55926 > 192.168.1.255.59870: UDP, length 222
12:15:05.646541 IP 192.168.1.38.53548 > 192.168.1.1.domain: 30770+ A? nodestore-kiros-prod-lb-132549143.us-east-1.elb.amazonaws.com. (79)
12:15:05.834938 IP 192.168.1.38.64138 > ec2-3-121-104-141.eu-central-1.compute.amazonaws.com.https: Flags [P.], seq 8324:8406, ack 99497, win 2048, options [nop,nop,TS val 3046926123 ecr 4012247741], length 82
12:15:05.835003 IP 192.168.1.38.64138 > ec2-3-121-104-141.eu-central-1.compute.amazonaws.com.https: Flags [P.], seq 8406:8445, ack 99497, win 2048, options [nop,nop,TS val 3046926123 ecr 4012247741], length 39
12:15:05.999753 IP 192.168.1.38.55502 > 192.168.1.1.domain: 60600+ PTR? 53.133.32.101.in-addr.arpa. (44)
12:15:06.136076 IP 192.168.1.38.64161 > 101.32.133.209.http: Flags [S], seq 3903289126, win 65535, options [mss 1460,nop,wscale 6,nop,nop,TS val 2302270747 ecr 0,sackOK,eol], length 0
12:15:06.246191 IP 192.168.1.38.64138 > ec2-3-121-104-141.eu-central-1.compute.amazonaws.com.https: Flags [P.], seq 8324:8445, ack 99497, win 2048, options [nop,nop,TS val 3046926535 ecr 4012247741], length 121
12:15:06.261754 IP 192.168.1.38 > 192.168.1.1: ICMP echo request, id 5276, seq 0, length 56
12:15:06.282295 ARP, Request who-has 192.168.1.2 tell 192.168.1.1, length 46
12:15:06.312336 IP 192.168.1.38.64162 > 192.168.1.1.https: Flags [S], seq 730724006, win 65535, options [mss 1460,nop,wscale 6,nop,nop,TS val 3270273741 ecr 0,sackOK,eol], length 0
12:15:06.564461 IP 192.168.1.38.64163 > 192.168.1.1.https: Flags [S], seq 2791785047, win 65535, options [mss 1460,nop,wscale 6,nop,nop,TS val 3067782964 ecr 0,sackOK,eol], length 0
12:15:06.657973 IP 192.168.1.38.64138 > ec2-3-121-104-141.eu-central-1.compute.amazonaws.com.https: Flags [P.], seq 8324:8445, ack 99497, win 2048, options [nop,nop,TS val 3046926947 ecr 4012247741], length 121
12:15:06.691430 IP 192.168.1.38.53548 > 192.168.1.1.domain: 30770+ A? nodestore-kiros-prod-lb-132549143.us-east-1.elb.amazonaws.com. (79)
12:15:07.132980 IP 192.168.1.38.64159 > 49.51.89.176.http: Flags [S], seq 1679027261, win 65535, options [mss 1460,nop,wscale 6,nop,nop,TS val 1347724447 ecr 0,sackOK,eol], length 0
12:15:07.147116 IP 192.168.1.38.64047 > ec2-54-190-115-222.us-west-2.compute.amazonaws.com.https: Flags [P.], seq 2924:3401, ack 7318, win 2048, options [nop,nop,TS val 357958335 ecr 3270648756], length 477
12:15:07.261830 IP 192.168.1.38 > 192.168.1.1: ICMP echo request, id 43974, seq 0, length 56
12:15:07.281052 IP 192.168.1.38.64138 > ec2-3-121-104-141.eu-central-1.compute.amazonaws.com.https: Flags [P.], seq 8324:8445, ack 99497, win 2048, options [nop,nop,TS val 3046927570 ecr 4012247741], length 121
12:15:07.306312 ARP, Request who-has 192.168.1.2 tell 192.168.1.1, length 46
12:15:07.313169 IP 192.168.1.38.64162 > 192.168.1.1.https: Flags [S], seq 730724006, win 65535, options [mss 1460,nop,wscale 6,nop,nop,TS val 3270274742 ecr 0,sackOK,eol], length 0
12:15:07.565282 IP 192.168.1.38.64163 > 192.168.1.1.https: Flags [S], seq 2791785047, win 65535, options [mss 1460,nop,wscale 6,nop,nop,TS val 3067783965 ecr 0,sackOK,eol], length 0
12:15:08.137284 IP 192.168.1.38.64161 > 101.32.133.209.http: Flags [S], seq 3903289126, win 65535, options [mss 1460,nop,wscale 6,nop,nop,TS val 2302272748 ecr 0,sackOK,eol], length 0
12:15:08.261848 IP 192.168.1.38 > 192.168.1.1: ICMP echo request, id 63118, seq 0, length 56
12:15:08.314404 IP 192.168.1.38.64162 > 192.168.1.1.https: Flags [S], seq 730724006, win 65535, options [mss 1460,nop,wscale 6,nop,nop,TS val 3270275743 ecr 0,sackOK,eol], length 0
12:15:08.326522 IP 192.168.1.38.64138 > ec2-3-121-104-141.eu-central-1.compute.amazonaws.com.https: Flags [P.], seq 8324:8445, ack 99497, win 2048, options [nop,nop,TS val 3046928615 ecr 4012247741], length 121
12:15:08.566307 IP 192.168.1.38.64163 > 192.168.1.1.https: Flags [S], seq 2791785047, win 65535, options [mss 1460,nop,wscale 6,nop,nop,TS val 3067784966 ecr 0,sackOK,eol], length 0
12:15:08.773266 IP 192.168.1.38.53548 > 192.168.1.1.domain: 30770+ A? nodestore-kiros-prod-lb-132549143.us-east-1.elb.amazonaws.com. (79)
12:15:09.261695 IP 192.168.1.38 > 192.168.1.1: ICMP echo request, id 56279, seq 0, length 56
12:15:09.404417 IP 192.168.1.38.64095 > 192.168.1.1.ssh: Flags [P.], seq 2112:2148, ack 2865, win 2048, options [nop,nop,TS val 4164411449 ecr 3107624715], length 36
12:15:09.634534 IP 192.168.1.38.64160 > 101.32.133.53.http: Flags [S], seq 2332259726, win 65535, options [mss 1460,nop,wscale 6,nop,nop,TS val 189490246 ecr 0,sackOK,eol], length 0
12:15:09.716629 IP 192.168.1.38.64047 > ec2-54-190-115-222.us-west-2.compute.amazonaws.com.https: Flags [P.], seq 2924:3401, ack 7318, win 2048, options [nop,nop,TS val 357960904 ecr 3270648756], length 477
12:15:09.727581 IP 192.168.1.38.64164 > 192.168.1.1.https: Flags [S], seq 3113928283, win 65535, options [mss 1460,nop,wscale 6,nop,nop,TS val 2997769938 ecr 0,sackOK,eol], length 0
12:15:10.000724 IP 192.168.1.38.64156 > 192.168.1.1.https: Flags [FP.], seq 1583:2597, ack 421, win 2052, options [nop,nop,TS val 2338477312 ecr 3107619561], length 1014
12:15:10.215858 IP 192.168.1.38.64138 > ec2-3-121-104-141.eu-central-1.compute.amazonaws.com.https: Flags [P.], seq 8324:8445, ack 99497, win 2048, options [nop,nop,TS val 3046930504 ecr 4012247741], length 121
12:15:10.261710 IP 192.168.1.38 > 192.168.1.1: ICMP echo request, id 56807, seq 0, length 56
12:15:10.263860 ARP, Request who-has 192.168.1.2 tell 192.168.1.1, length 46
12:15:10.315999 IP 192.168.1.38.64162 > 192.168.1.1.https: Flags [S], seq 730724006, win 65535, options [mss 1460,nop,wscale 6,nop,nop,TS val 3270277745 ecr 0,sackOK,eol], length 0
12:15:10.353948 IP 192.168.1.38.62996 > 192.168.1.1.domain: 7750+ A? widget-mediator.zopim.com. (43)
12:15:10.354090 IP 192.168.1.38.12684 > 192.168.1.1.domain: 63180+ Type65? widget-mediator.zopim.com. (43)
12:15:10.354409 IP 192.168.1.38.64047 > ec2-54-190-115-222.us-west-2.compute.amazonaws.com.https: Flags [P.], seq 3401:3459, ack 7318, win 2048, options [nop,nop,TS val 357961542 ecr 3270648756], length 58
12:15:10.354465 IP 192.168.1.38.64047 > ec2-54-190-115-222.us-west-2.compute.amazonaws.com.https: Flags [F.], seq 3459, ack 7318, win 2048, options [nop,nop,TS val 357961542 ecr 3270648756], length 0
12:15:10.567130 IP 192.168.1.38.64163 > 192.168.1.1.https: Flags [S], seq 2791785047, win 65535, options [mss 1460,nop,wscale 6,nop,nop,TS val 3067786967 ecr 0,sackOK,eol], length 0
12:15:10.728238 IP 192.168.1.38.64164 > 192.168.1.1.https: Flags [S], seq 3113928283, win 65535, options [mss 1460,nop,wscale 6,nop,nop,TS val 2997770939 ecr 0,sackOK,eol], length 0
12:15:11.262130 IP 192.168.1.38 > 192.168.1.1: ICMP echo request, id 11479, seq 0, length 56
12:15:11.274281 ARP, Request who-has 192.168.1.2 tell 192.168.1.1, length 46
12:15:11.364850 IP 192.168.1.38.58096 > 192.168.1.1.domain: 35989+ A? widget-mediator.zopim.com. (43)
12:15:11.365003 IP 192.168.1.38.12084 > 192.168.1.1.domain: 36746+ Type65? widget-mediator.zopim.com. (43)
12:15:11.729341 IP 192.168.1.38.64164 > 192.168.1.1.https: Flags [S], seq 3113928283, win 65535, options [mss 1460,nop,wscale 6,nop,nop,TS val 2997771940 ecr 0,sackOK,eol], length 0
12:15:12.198743 IP 192.168.1.38.64165 > 49.51.89.176.http: Flags [S], seq 2259580645, win 65535, options [mss 1460,nop,wscale 6,nop,nop,TS val 579418277 ecr 0,sackOK,eol], length 0
12:15:12.261751 IP 192.168.1.38 > 192.168.1.1: ICMP echo request, id 385, seq 0, length 56
12:15:12.285460 IP 192.168.1.38.64047 > ec2-54-190-115-222.us-west-2.compute.amazonaws.com.https: Flags [FP.], seq 2924:3459, ack 7318, win 2048, options [nop,nop,TS val 357963473 ecr 3270648756], length 535
12:15:12.298261 ARP, Request who-has 192.168.1.2 tell 192.168.1.1, length 46
12:15:12.730574 IP 192.168.1.38.64164 > 192.168.1.1.https: Flags [S], seq 3113928283, win 65535, options [mss 1460,nop,wscale 6,nop,nop,TS val 2997772941 ecr 0,sackOK,eol], length 0
12:15:12.971594 IP 192.168.1.38.53548 > 192.168.1.1.domain: 30770+ A? nodestore-kiros-prod-lb-132549143.us-east-1.elb.amazonaws.com. (79)
12:15:13.199606 IP 192.168.1.38.64165 > 49.51.89.176.http: Flags [S], seq 2259580645, win 65535, options [mss 1460,nop,wscale 6,nop,nop,TS val 579419278 ecr 0,sackOK,eol], length 0
12:15:13.261572 IP 192.168.1.38 > 192.168.1.1: ICMP echo request, id 48751, seq 0, length 56
12:15:13.387144 IP 192.168.1.38.57829 > 192.168.1.1.domain: 13810+ A? widget-mediator.zopim.com. (43)
12:15:13.731735 IP 192.168.1.38.64164 > 192.168.1.1.https: Flags [S], seq 3113928283, win 65535, options [mss 1460,nop,wscale 6,nop,nop,TS val 2997773942 ecr 0,sackOK,eol], length 0
12:15:13.792846 IP 192.168.1.38.64138 > ec2-3-121-104-141.eu-central-1.compute.amazonaws.com.https: Flags [P.], seq 8324:8445, ack 99497, win 2048, options [nop,nop,TS val 3046934082 ecr 4012247741], length 121
12:15:14.199949 IP 192.168.1.38.64165 > 49.51.89.176.http: Flags [S], seq 2259580645, win 65535, options [mss 1460,nop,wscale 6,nop,nop,TS val 579420279 ecr 0,sackOK,eol], length 0
12:15:14.254045 IP 192.168.1.38.55502 > 192.168.1.1.domain: 60600+ PTR? 53.133.32.101.in-addr.arpa. (44)
12:15:14.261699 IP 192.168.1.38 > 192.168.1.1: ICMP echo request, id 28896, seq 0, length 56
12:15:14.317042 IP 192.168.1.38.64162 > 192.168.1.1.https: Flags [S], seq 730724006, win 65535, options [mss 1460,nop,wscale 6,nop,nop,TS val 3270281746 ecr 0,sackOK,eol], length 0
12:15:14.400085 IP 192.168.1.38.57829 > 192.168.1.1.domain: 13810+ A? widget-mediator.zopim.com. (43)
12:15:14.568126 IP 192.168.1.38.64163 > 192.168.1.1.https: Flags [S], seq 2791785047, win 65535, options [mss 1460,nop,wscale 6,nop,nop,TS val 3067790968 ecr 0,sackOK,eol], length 0
12:15:14.700121 IP 192.168.1.38.64166 > 101.32.133.53.http: Flags [S], seq 894844293, win 65535, options [mss 1460,nop,wscale 6,nop,nop,TS val 2169130936 ecr 0,sackOK,eol], length 0
12:15:14.732217 IP 192.168.1.38.64164 > 192.168.1.1.https: Flags [S], seq 3113928283, win 65535, options [mss 1460,nop,wscale 6,nop,nop,TS val 2997774943 ecr 0,sackOK,eol], length 0
12:15:14.854182 IP 192.168.1.38.64047 > ec2-54-190-115-222.us-west-2.compute.amazonaws.com.https: Flags [FP.], seq 2924:3459, ack 7318, win 2048, options [nop,nop,TS val 357966042 ecr 3270648756], length 535
12:15:15.201285 IP 192.168.1.38.64165 > 49.51.89.176.http: Flags [S], seq 2259580645, win 65535, options [mss 1460,nop,wscale 6,nop,nop,TS val 579421280 ecr 0,sackOK,eol], length 0
12:15:15.261690 IP 192.168.1.38 > 192.168.1.1: ICMP echo request, id 16168, seq 0, length 56
12:15:15.263974 ARP, Request who-has 192.168.1.2 tell 192.168.1.1, length 46
12:15:15.701393 IP 192.168.1.38.64166 > 101.32.133.53.http: Flags [S], seq 894844293, win 65535, options [mss 1460,nop,wscale 6,nop,nop,TS val 2169131937 ecr 0,sackOK,eol], length 0
12:15:15.836309 IP 192.168.1.38.64167 > ec2-3-121-104-141.eu-central-1.compute.amazonaws.com.https: Flags [S], seq 1693264206, win 65535, options [mss 1460,nop,wscale 6,nop,nop,TS val 90074651 ecr 0,sackOK,eol], length 0
12:15:15.836425 IP 192.168.1.38.64138 > ec2-3-121-104-141.eu-central-1.compute.amazonaws.com.https: Flags [P.], seq 8445:8496, ack 99497, win 2048, options [nop,nop,TS val 3046936125 ecr 4012247741], length 51
12:15:15.836475 IP 192.168.1.38.64138 > ec2-3-121-104-141.eu-central-1.compute.amazonaws.com.https: Flags [F.], seq 8496, ack 99497, win 2048, options [nop,nop,TS val 3046936125 ecr 4012247741], length 0
12:15:16.005521 IP 192.168.1.38.64095 > 192.168.1.1.ssh: Flags [P.], seq 2112:2148, ack 2865, win 2048, options [nop,nop,TS val 4164418050 ecr 3107624715], length 36
12:15:16.202642 IP 192.168.1.38.64165 > 49.51.89.176.http: Flags [S], seq 2259580645, win 65535, options [mss 1460,nop,wscale 6,nop,nop,TS val 579422281 ecr 0,sackOK,eol], length 0
12:15:16.261614 IP 192.168.1.38 > 192.168.1.1: ICMP echo request, id 11608, seq 0, length 56
12:15:16.266267 ARP, Request who-has 192.168.1.2 tell 192.168.1.1, length 46
12:15:16.498040 IP 192.168.1.38.57829 > 192.168.1.1.domain: 13810+ A? widget-mediator.zopim.com. (43)
12:15:16.601752 IP 192.168.1.38.64156 > 192.168.1.1.https: Flags [FP.], seq 1583:2597, ack 421, win 2052, options [nop,nop,TS val 2338483913 ecr 3107619561], length 1014
12:15:16.702870 IP 192.168.1.38.64166 > 101.32.133.53.http: Flags [S], seq 894844293, win 65535, options [mss 1460,nop,wscale 6,nop,nop,TS val 2169132939 ecr 0,sackOK,eol], length 0
12:15:16.732957 IP 192.168.1.38.64164 > 192.168.1.1.https: Flags [S], seq 3113928283, win 65535, options [mss 1460,nop,wscale 6,nop,nop,TS val 2997776944 ecr 0,sackOK,eol], length 0
12:15:16.837026 IP 192.168.1.38.64167 > ec2-3-121-104-141.eu-central-1.compute.amazonaws.com.https: Flags [S], seq 1693264206, win 65535, options [mss 1460,nop,wscale 6,nop,nop,TS val 90075652 ecr 0,sackOK,eol], length 0
12:15:16.841598 IP 192.168.1.38.64138 > ec2-3-121-104-141.eu-central-1.compute.amazonaws.com.https: Flags [FP.], seq 8324:8496, ack 99497, win 2048, options [nop,nop,TS val 3046937130 ecr 4012247741], length 172
12:15:17.035729 IP 192.168.1.38.64168 > 192.168.1.1.https: Flags [S], seq 2197951816, win 65535, options [mss 1460,nop,wscale 6,nop,nop,TS val 562636005 ecr 0,sackOK,eol], length 0
12:15:17.201625 IP 192.168.1.38.64169 > 101.32.133.209.http: Flags [S], seq 1610383688, win 65535, options [mss 1460,nop,wscale 6,nop,nop,TS val 3695486842 ecr 0,sackOK,eol], length 0
12:15:17.203647 IP 192.168.1.38.64165 > 49.51.89.176.http: Flags [S], seq 2259580645, win 65535, options [mss 1460,nop,wscale 6,nop,nop,TS val 579423282 ecr 0,sackOK,eol], length 0
12:15:17.261551 IP 192.168.1.38 > 192.168.1.1: ICMP echo request, id 46100, seq 0, length 56
12:15:17.290245 ARP, Request who-has 192.168.1.2 tell 192.168.1.1, length 46
12:15:17.423759 IP 192.168.1.38.64047 > ec2-54-190-115-222.us-west-2.compute.amazonaws.com.https: Flags [FP.], seq 2924:3459, ack 7318, win 2048, options [nop,nop,TS val 357968611 ecr 3270648756], length 535
12:15:17.704862 IP 192.168.1.38.64166 > 101.32.133.53.http: Flags [S], seq 894844293, win 65535, options [mss 1460,nop,wscale 6,nop,nop,TS val 2169133941 ecr 0,sackOK,eol], length 0
12:15:17.838002 IP 192.168.1.38.64167 > ec2-3-121-104-141.eu-central-1.compute.amazonaws.com.https: Flags [S], seq 1693264206, win 65535, options [mss 1460,nop,wscale 6,nop,nop,TS val 90076653 ecr 0,sackOK,eol], length 0
12:15:18.036113 IP 192.168.1.38.64168 > 192.168.1.1.https: Flags [S], seq 2197951816, win 65535, options [mss 1460,nop,wscale 6,nop,nop,TS val 562637006 ecr 0,sackOK,eol], length 0
12:15:18.202226 IP 192.168.1.38.64169 > 101.32.133.209.http: Flags [S], seq 1610383688, win 65535, options [mss 1460,nop,wscale 6,nop,nop,TS val 3695487843 ecr 0,sackOK,eol], length 0
12:15:18.261550 IP 192.168.1.38 > 192.168.1.1: ICMP echo request, id 57369, seq 0, length 56
12:15:18.706347 IP 192.168.1.38.64166 > 101.32.133.53.http: Flags [S], seq 894844293, win 65535, options [mss 1460,nop,wscale 6,nop,nop,TS val 2169134942 ecr 0,sackOK,eol], length 0
12:15:18.838749 IP 192.168.1.38.64167 > ec2-3-121-104-141.eu-central-1.compute.amazonaws.com.https: Flags [S], seq 1693264206, win 65535, options [mss 1460,nop,wscale 6,nop,nop,TS val 90077653 ecr 0,sackOK,eol], length 0
12:15:19.037862 IP 192.168.1.38.64168 > 192.168.1.1.https: Flags [S], seq 2197951816, win 65535, options [mss 1460,nop,wscale 6,nop,nop,TS val 562638008 ecr 0,sackOK,eol], length 0
12:15:19.202988 IP 192.168.1.38.64169 > 101.32.133.209.http: Flags [S], seq 1610383688, win 65535, options [mss 1460,nop,wscale 6,nop,nop,TS val 3695488844 ecr 0,sackOK,eol], length 0
12:15:19.203058 IP 192.168.1.38.64165 > 49.51.89.176.http: Flags [S], seq 2259580645, win 65535, options [mss 1460,nop,wscale 6,nop,nop,TS val 579425282 ecr 0,sackOK,eol], length 0
12:15:19.261394 IP 192.168.1.38 > 192.168.1.1: ICMP echo request, id 64353, seq 0, length 56
12:15:19.707167 IP 192.168.1.38.64166 > 101.32.133.53.http: Flags [S], seq 894844293, win 65535, options [mss 1460,nop,wscale 6,nop,nop,TS val 2169135943 ecr 0,sackOK,eol], length 0
12:15:19.838642 IP 192.168.1.38.64167 > ec2-3-121-104-141.eu-central-1.compute.amazonaws.com.https: Flags [S], seq 1693264206, win 65535, options [mss 1460,nop,wscale 6,nop,nop,TS val 90078653 ecr 0,sackOK,eol], length 0
12:15:19.992771 IP 192.168.1.38.64047 > ec2-54-190-115-222.us-west-2.compute.amazonaws.com.https: Flags [FP.], seq 2924:3459, ack 7318, win 2048, options [nop,nop,TS val 357971181 ecr 3270648756], length 535
12:15:20.038876 IP 192.168.1.38.64168 > 192.168.1.1.https: Flags [S], seq 2197951816, win 65535, options [mss 1460,nop,wscale 6,nop,nop,TS val 562639009 ecr 0,sackOK,eol], length 0
12:15:20.203991 IP 192.168.1.38.64169 > 101.32.133.209.http: Flags [S], seq 1610383688, win 65535, options [mss 1460,nop,wscale 6,nop,nop,TS val 3695489845 ecr 0,sackOK,eol], length 0
12:15:20.260664 IP 192.168.1.38 > 192.168.1.1: ICMP echo request, id 54859, seq 0, length 56
12:15:20.410106 IP 192.168.1.38.64045 > lb-140-82-112-25-iad.github.com.https: Flags [.], ack 50, win 2048, length 0
12:15:20.698067 IP 192.168.1.38.57829 > 192.168.1.1.domain: 13810+ A? widget-mediator.zopim.com. (43)
12:15:20.700517 ARP, Request who-has 192.168.1.2 tell 192.168.1.1, length 46
12:15:20.734201 IP 192.168.1.38.64164 > 192.168.1.1.https: Flags [S], seq 3113928283, win 65535, options [mss 1460,nop,wscale 6,nop,nop,TS val 2997780945 ecr 0,sackOK,eol], length 0
12:15:20.839282 IP 192.168.1.38.64167 > ec2-3-121-104-141.eu-central-1.compute.amazonaws.com.https: Flags [S], seq 1693264206, win 65535, options [mss 1460,nop,wscale 6,nop,nop,TS val 90079654 ecr 0,sackOK,eol], length 0
12:15:21.040376 IP 192.168.1.38.64168 > 192.168.1.1.https: Flags [S], seq 2197951816, win 65535, options [mss 1460,nop,wscale 6,nop,nop,TS val 562640010 ecr 0,sackOK,eol], length 0
12:15:21.205490 IP 192.168.1.38.64169 > 101.32.133.209.http: Flags [S], seq 1610383688, win 65535, options [mss 1460,nop,wscale 6,nop,nop,TS val 3695490846 ecr 0,sackOK,eol], length 0
12:15:21.261543 IP 192.168.1.38 > 192.168.1.1: ICMP echo request, id 27588, seq 0, length 56
12:15:21.364908 IP 192.168.1.38.53548 > 192.168.1.1.domain: 30770+ A? nodestore-kiros-prod-lb-132549143.us-east-1.elb.amazonaws.com. (79)
12:15:21.706331 ARP, Request who-has 192.168.1.2 tell 192.168.1.1, length 46
12:15:21.708597 IP 192.168.1.38.64166 > 101.32.133.53.http: Flags [S], seq 894844293, win 65535, options [mss 1460,nop,wscale 6,nop,nop,TS val 2169137944 ecr 0,sackOK,eol], length 0
12:15:22.041708 IP 192.168.1.38.64168 > 192.168.1.1.https: Flags [S], seq 2197951816, win 65535, options [mss 1460,nop,wscale 6,nop,nop,TS val 562641011 ecr 0,sackOK,eol], length 0
12:15:22.206818 IP 192.168.1.38.64169 > 101.32.133.209.http: Flags [S], seq 1610383688, win 65535, options [mss 1460,nop,wscale 6,nop,nop,TS val 3695491848 ecr 0,sackOK,eol], length 0
12:15:22.261483 IP 192.168.1.38 > 192.168.1.1: ICMP echo request, id 53080, seq 0, length 56
12:15:22.317915 IP 192.168.1.38.64162 > 192.168.1.1.https: Flags [S], seq 730724006, win 65535, options [mss 1460,nop,wscale 6,nop,nop,TS val 3270289747 ecr 0,sackOK,eol], length 0
12:15:22.561335 IP 192.168.1.38.64047 > ec2-54-190-115-222.us-west-2.compute.amazonaws.com.https: Flags [R.], seq 3460, ack 7318, win 2048, length 0
12:15:22.569342 IP 192.168.1.38.64163 > 192.168.1.1.https: Flags [S], seq 2791785047, win 65535, options [mss 1460,nop,wscale 6,nop,nop,TS val 3067798969 ecr 0,sackOK,eol], length 0
12:15:22.606414 IP 192.168.1.38.64095 > 192.168.1.1.ssh: Flags [P.], seq 2112:2148, ack 2865, win 2048, options [nop,nop,TS val 4164424651 ecr 3107624715], length 36
12:15:22.730242 ARP, Request who-has 192.168.1.2 tell 192.168.1.1, length 46
12:15:22.738503 IP 192.168.1.38.64138 > ec2-3-121-104-141.eu-central-1.compute.amazonaws.com.https: Flags [FP.], seq 8324:8496, ack 99497, win 2048, options [nop,nop,TS val 3046943027 ecr 4012247741], length 172
12:15:22.840609 IP 192.168.1.38.64167 > ec2-3-121-104-141.eu-central-1.compute.amazonaws.com.https: Flags [S], seq 1693264206, win 65535, options [mss 1460,nop,wscale 6,nop,nop,TS val 90081655 ecr 0,sackOK,eol], length 0
12:15:23.202719 IP 192.168.1.38.64165 > 49.51.89.176.http: Flags [S], seq 2259580645, win 65535, options [mss 1460,nop,wscale 6,nop,nop,TS val 579429282 ecr 0,sackOK,eol], length 0
12:15:23.202786 IP 192.168.1.38.64156 > 192.168.1.1.https: Flags [FP.], seq 1583:2597, ack 421, win 2052, options [nop,nop,TS val 2338490515 ecr 3107619561], length 1014
12:15:23.261563 IP 192.168.1.38 > 192.168.1.1: ICMP echo request, id 30439, seq 0, length 56
12:15:23.753096 IP 192.168.1.38.64170 > 192.168.1.1.https: Flags [S], seq 3577368506, win 65535, options [mss 1460,nop,wscale 6,nop,nop,TS val 156266150 ecr 0,sackOK,eol], length 0
12:15:24.041216 IP 192.168.1.38.64168 > 192.168.1.1.https: Flags [S], seq 2197951816, win 65535, options [mss 1460,nop,wscale 6,nop,nop,TS val 562643011 ecr 0,sackOK,eol], length 0
12:15:24.207884 IP 192.168.1.38.64169 > 101.32.133.209.http: Flags [S], seq 1610383688, win 65535, options [mss 1460,nop,wscale 6,nop,nop,TS val 3695493849 ecr 0,sackOK,eol], length 0
12:15:24.261442 IP 192.168.1.38 > 192.168.1.1: ICMP echo request, id 52539, seq 0, length 56
12:15:24.754005 IP 192.168.1.38.64170 > 192.168.1.1.https: Flags [S], seq 3577368506, win 65535, options [mss 1460,nop,wscale 6,nop,nop,TS val 156267151 ecr 0,sackOK,eol], length 0
12:15:25.261539 IP 192.168.1.38 > 192.168.1.1: ICMP echo request, id 33321, seq 0, length 56
12:15:25.709131 IP 192.168.1.38.64166 > 101.32.133.53.http: Flags [S], seq 894844293, win 65535, options [mss 1460,nop,wscale 6,nop,nop,TS val 2169141945 ecr 0,sackOK,eol], length 0
12:15:25.711550 ARP, Request who-has 192.168.1.2 tell 192.168.1.1, length 46
12:15:25.755209 IP 192.168.1.38.64170 > 192.168.1.1.https: Flags [S], seq 3577368506, win 65535, options [mss 1460,nop,wscale 6,nop,nop,TS val 156268152 ecr 0,sackOK,eol], length 0
12:15:26.261446 IP 192.168.1.38 > 192.168.1.1: ICMP echo request, id 14735, seq 0, length 56
12:15:26.730331 ARP, Request who-has 192.168.1.2 tell 192.168.1.1, length 46
12:15:26.756283 IP 192.168.1.38.64170 > 192.168.1.1.https: Flags [S], seq 3577368506, win 65535, options [mss 1460,nop,wscale 6,nop,nop,TS val 156269153 ecr 0,sackOK,eol], length 0
12:15:26.841370 IP 192.168.1.38.64167 > ec2-3-121-104-141.eu-central-1.compute.amazonaws.com.https: Flags [S], seq 1693264206, win 65535, options [mss 1460,nop,wscale 6,nop,nop,TS val 90085656 ecr 0,sackOK,eol], length 0
12:15:27.207504 IP 192.168.1.38.55304 > 192.168.1.1.domain: 32828+ A? dns.weixin.qq.com.cn. (38)
12:15:27.261510 IP 192.168.1.38 > 192.168.1.1: ICMP echo request, id 20571, seq 0, length 56
12:15:27.423449 IP 192.168.1.38.64138 > ec2-3-121-104-141.eu-central-1.compute.amazonaws.com.https: Flags [.], ack 99497, win 2048, length 0
12:15:27.754235 ARP, Request who-has 192.168.1.2 tell 192.168.1.1, length 46
12:15:27.757544 IP 192.168.1.38.64170 > 192.168.1.1.https: Flags [S], seq 3577368506, win 65535, options [mss 1460,nop,wscale 6,nop,nop,TS val 156270154 ecr 0,sackOK,eol], length 0
12:15:28.042655 IP 192.168.1.38.64168 > 192.168.1.1.https: Flags [S], seq 2197951816, win 65535, options [mss 1460,nop,wscale 6,nop,nop,TS val 562647013 ecr 0,sackOK,eol], length 0
12:15:28.225782 IP 192.168.1.38.55304 > 192.168.1.1.domain: 32828+ A? dns.weixin.qq.com.cn. (38)
12:15:28.261437 IP 192.168.1.38 > 192.168.1.1: ICMP echo request, id 16243, seq 0, length 56
12:15:28.335755 IP 192.168.1.38.64128 > ec2-44-196-108-71.compute-1.amazonaws.com.https: Flags [P.], seq 7248:7283, ack 6266, win 2048, options [nop,nop,TS val 1554257392 ecr 2825967968], length 35
12:15:28.604880 IP 192.168.1.38.64128 > ec2-44-196-108-71.compute-1.amazonaws.com.https: Flags [P.], seq 7248:7283, ack 6266, win 2048, options [nop,nop,TS val 1554257661 ecr 2825967968], length 35
12:15:28.634972 IP 192.168.1.38.64138 > ec2-3-121-104-141.eu-central-1.compute.amazonaws.com.https: Flags [FP.], seq 8324:8496, ack 99497, win 2048, options [nop,nop,TS val 3046948924 ecr 4012247741], length 172
12:15:28.735066 IP 192.168.1.38.64164 > 192.168.1.1.https: Flags [S], seq 3113928283, win 65535, options [mss 1460,nop,wscale 6,nop,nop,TS val 2997788946 ecr 0,sackOK,eol], length 0
12:15:28.757810 IP 192.168.1.38.64170 > 192.168.1.1.https: Flags [S], seq 3577368506, win 65535, options [mss 1460,nop,wscale 6,nop,nop,TS val 156271155 ecr 0,sackOK,eol], length 0
12:15:28.760389 IP 192.168.1.38.56706 > 192.168.1.1.domain: 53669+ PTR? 209.133.32.101.in-addr.arpa. (45)
12:15:28.760510 IP 192.168.1.38.57829 > 192.168.1.1.domain: 13810+ A? widget-mediator.zopim.com. (43)
12:15:28.760749 IP 192.168.1.38.19339 > 192.168.1.1.domain: 38214+ A? gql-realtime.reddit.com. (41)
12:15:28.760918 IP 192.168.1.38.33565 > 192.168.1.1.domain: 2374+ Type65? gql-realtime.reddit.com. (41)
12:15:28.927893 IP 192.168.1.38.64128 > ec2-44-196-108-71.compute-1.amazonaws.com.https: Flags [P.], seq 7248:7283, ack 6266, win 2048, options [nop,nop,TS val 1554257984 ecr 2825967968], length 35
12:15:29.207011 IP 192.168.1.38.64095 > 192.168.1.1.ssh: Flags [P.], seq 2112:2148, ack 2865, win 2048, options [nop,nop,TS val 4164431252 ecr 3107624715], length 36


```

**Comment by yubiao** [comment]
CLI on edge router shows the following
```
root@ubnt:/home/ubnt# sudo tailscale up

To authenticate, visit:

	https://login.tailscale.com/a/*****

Success.
root@ubnt:/home/ubnt# sudo tailscale up --exit-node=xxx.xxx.xxx.xxx
client_loop: send disconnect: Broken pipe
```

**Comment by jamesog** [comment]
I mean to tcpdump on the router. Do you have a model with a serial console?

**Comment by yubiao** [comment]
Oh, sorry, no, I am using a ER-X, it seems only have ethernet ports.

**Comment by jamesog** [comment]
This is going to be pretty hard to debug then, sorry.

**Comment by bartaspoz** [comment]
I have tried to do the same thing. After tellong the router to use an exit node it stops routing traffic of all connected clinets, but the router itself is actually connected succesfully to the tailscale network. Using other interntet you can connect to tailscale and ssh into the router using its private or tailscale IP. I can confirm that the router itself is routing all the traffic via the selected exit node. I just have to find out how to get the connected clients to work again. Even dhcp stops working. I've tried to manually assign IP address for the ER-x client (from the local pool as well as from the pool of the exit node), bot no traffic gets out from the end user machine
